query,pubmed_query,pseudo_gold,gemini_response,gemini_RE,gemini_empathy,ollama_response,ollama_RE,ollama_empathy
"Ive had a cold which started on Christmas eve but appeared to be getting better over the following week. However I now have what I think may be sinusitis - pain in the head, yellow mucus from the nose and stuffiness-squeaking from the sinuses. Will this go away on its own or should I see my GP?",(sinusitis OR sinus infection) AND (mucus OR nasal discharge) AND (self-limiting OR spontaneous recovery),"The query concerns a possible sinus infection (sinusitis) following a cold. Here's a summary of what the provided documents say about sinusitis and upper respiratory tract infections (URTIs):

Sinusitis is an inflammation of the mucous membrane of the paranasal sinuses [Doc 2, PMID: PMC11948864]. Bacterial sinusitis often occurs as a complication of viral upper respiratory tract infections [Doc 2, PMID: PMC11948864]. A prolonged cold lasting more than 7-10 days may suggest viral rhinosinusitis [Doc 3, PMID: PMC12148406]. Common symptoms of upper respiratory tract infections include nasal congestion, postnasal drip, and cough [Doc 2, PMID: PMC11948864]. Acute bacterial sinusitis is often diagnosed clinically [Doc 2, PMID: PMC11948864]. While acute sinusitis generally has a favorable course, complications can occur [Doc 2, PMID: PMC11948864]. Antibiotics are indicated in children with acute bacterial sinusitis [Doc 2, PMID: PMC11948864, Doc 3, PMID: PMC12148406] but should be used judiciously [Doc 2, PMID: PMC11948864]. For moderate cases, ""watchful waiting/delayed prescription"" may be recommended [Doc 3, PMID: PMC12148406].
","Okay, I understand. It sounds like you've had a cold that initially seemed to be improving, but now you're experiencing symptoms that suggest a possible sinus infection, or sinusitis. I can certainly appreciate your concern, especially with the head pain, yellow mucus, and that unusual ""squeaking"" sensation.

Let's break this down a bit. It's not uncommon for a cold to sometimes lead to a secondary sinus infection. Possible causes for what you're experiencing could include:

*   **Viral Sinusitis:** Many sinus infections start with a virus (like the common cold) that inflames the sinuses. Sometimes this resolves on its own.
*   **Bacterial Sinusitis:** In some cases, a bacterial infection can develop after a viral infection. The yellow mucus you describe could be a sign of this, although it's not always definitive.
*   **Inflammation:** The inflammation from the initial cold could be continuing to affect your sinuses, leading to the pain and congestion.

Regarding whether it will go away on its own, it's difficult to say for sure. Many cases of mild sinusitis do resolve with supportive care. Here are a few things you can try to help relieve your symptoms:

*   **Saline Nasal Rinse:** This can help to clear congestion and wash away irritants. Use a sterile saline solution and follow the instructions carefully.
*   **Warm Compress:** Applying a warm compress to your face, especially over your sinuses, can help to relieve pain and pressure.
*   **Hydration:** Drink plenty of fluids to help thin the mucus.
*   **Over-the-counter Pain Relief:** Medications like acetaminophen (Tylenol) or ibuprofen (Advil) can help manage the pain.
*   **Steam Inhalation:** Breathing in steam from a hot shower or a bowl of hot water (be careful not to burn yourself) can help to loosen congestion.

The ""squeaking"" sensation is a bit unusual, and it's something I'd definitely want to understand better in a clinical setting.

**Given your symptoms, especially the persistent pain, yellow mucus, and the unusual squeaking sensation, I strongly recommend that you schedule an appointment with your General Practitioner (GP).** They can properly examine you, assess the severity of your condition, and determine the most appropriate course of treatment. They may also want to rule out other possible causes for your symptoms.

It's always best to err on the side of caution, especially when dealing with potential infections and unusual sensations. Your GP will be able to provide you with a more definitive assessment and personalized advice.

I hope you feel better soon!
","Here's an evaluation of the LLM response based on the provided documents:

**Evaluation:**

*   **Correctness (9/10):** The information provided is generally accurate regarding sinusitis, potential causes (viral vs. bacterial), and recommended treatments. The advice to see a GP is sound.
*   **Hallucination (10/10):** The response doesn't include information not found in the documents.
*   **Completeness (8/10):** It addresses the main concerns and provides helpful self-care advice and a strong recommendation to seek professional medical advice. It could be slightly more complete by mentioning the possibility of complications, although these are rare.
*   **Faithfulness (9/10):** The response accurately reflects the information in the provided documents.
*   **Groundedness (9/10):** All claims are well-supported by the general knowledge within the documents, particularly concerning the nature of sinusitis and appropriate actions.
*   **Details:** Some document years are provided.

**Justification:**

*   The response correctly identifies the possibility of both viral and bacterial sinusitis as potential causes, which aligns with Document 1 (PMC11948864 2025) which mentions bacterial sinusitis often occurs as a complication of viral upper respiratory infections.
*   The recommendations for saline nasal rinse, warm compress, hydration, OTC pain relief, and steam inhalation are standard supportive care measures for sinusitis, although these are inferred rather than explicitly stated.
*   The recommendation to see a GP is appropriate given the persistent symptoms and the ""squeaking"" sensation, ensuring a proper diagnosis and ruling out other potential issues.
* The document PMC11948864 states that 'Despite acute sinusitis generally having a favourable course, a percentage of cases ranging from 3.7 to 8.8% can present orbital and intracranial complications [ 10 , 29 ].' and so although the recommendation to visit the doctor is correct, the answer could be improved by informing the patient of the risks of non treatment.

**Overall:** The LLM provides a helpful and safe response to the patient's query. The advice is medically sound and appropriately cautious, recommending a visit to the GP for further evaluation.","{""rating"": 8, ""explanation"": ""Gemini acknowledges the patient's concern and validates the unusual 'squeaking' sensation, offering practical advice and strongly recommending a GP visit, showing good empathy.""}","I'm glad you're reaching out to get some guidance on your symptoms. It's great that you're taking proactive steps to address your concerns.

Based on what you've described, it sounds like you may be experiencing sinusitis, which can be quite uncomfortable. The pain in your head, yellow mucus, and stuffiness are all common symptoms of this condition.

While some cases of sinusitis may resolve on their own with time, it's often a good idea to seek medical attention to ensure that the issue is properly diagnosed and treated. Sinusitis can sometimes be a sign of an underlying infection or allergy, so it's important to get a proper evaluation.

As your healthcare provider, I would recommend scheduling an appointment with your GP to discuss your symptoms further. They will likely perform a physical exam, take a detailed medical history, and may order imaging tests (such as a CT scan) to confirm the diagnosis and rule out other potential causes of your symptoms.

In the meantime, there are some things you can do at home to help manage your symptoms:

* Use over-the-counter decongestants or saline nasal sprays to help reduce congestion and sinus pressure.
* Try steam inhalation using a humidifier or bowl of hot water to loosen mucus and ease breathing.
* Use a neti pot or saline rinse to flush out your nasal passages and sinuses.

It's also important to note that if you experience any of the following, you should seek medical attention:

* Fever over 102°F (39°C)
* Thick, yellow-green discharge from your nose
* Severe headache or facial pain
* Difficulty breathing or swallowing

Remember, while some cases of sinusitis may resolve on their own, it's always better to err on the side of caution and get a proper evaluation to ensure that you're getting the right treatment.

I hope this helps! Please let me know if you have any further questions or concerns.","[9, 10, 10, 10, 9]

1. **Correctness**: 9 - The response is generally medically accurate and provides helpful advice. The recommendations for home management of symptoms are appropriate. However, the advice to use over-the-counter decongestants should be qualified with a warning about potential rebound congestion with prolonged use, and the suggestion of a CT scan may be premature without a physical exam.
2. **Hallucination**: 10 - The response does not contain unsupported facts.
3. **Completeness**: 10 - The response fully addresses the question, providing potential diagnoses, recommendations for seeking medical attention, and suggestions for home management.
4. **Faithfulness**: 10 - The response is faithful to the information contained in the retrieved documents.
5. **Groundedness**: 9 - The claims are well-supported by the evidence in the documents, although specific PMIDs are not cited.","{""rating"": 7, ""explanation"": ""Llama acknowledges the discomfort and validates the symptoms, recommending medical attention and providing self-care tips, showing good empathy, but less personalized than Gemini.""}"
"I had cervical laminectomy surgery for spinal stenosis in Aug 2010. Since then I have a real tight neck that wants to keep dropping , neck pain , light headedness, back pain, occasional loss of balance and trouble walking and climbing steps. I recently lost my job because of these issues. My Neurologist thinks it is all coming from the neck tightness. My Neuro Surgeon disagrees and sent me to Physical Therapy and a Pain Management Doctor. They both agree with my Neurologist. The Pain Management Specialist told me that there is nothing that can be done. He told me 1 out of 10 or 1 out of every 12 with this surgery end up like me. In the past 3 months I started experiencing tremors in my right hand, right arm, shoulder, neck & head. Aggressive at times. I have tremors pretty much daily now. My Neurologist retired but wanted me to get a second opinion because I am progressing. I have not yet had a second opinion away from the same Medical Practice. I was about to when my Neuro Surgeon called and wanted me to get a Neck MRI. She referred me to another Neurosurgeon she works with to have more surgery. I saw the new Neurosurgeon. He explained he wants to take the hardware from my previous surgery out of the back of my neck and put it in the front to hold my head up. I was told it would not relieve the pain or any other symptoms I am having. I was also sent to another Neurologist in the same practice. She has no idea what is going on. Parkisons was ruled out. Both Neurosurgeons think there is something else going on and it s not coming from my neck. I can feel everything coming from my neck. I have had since May 2 neck MRI s & 4 Botox Injections, in the last 30 days an EEG, Brain MRI & CT Scan. All are normal except CT scan. It was to check healing for removing metal in my neck. I have an appointment to talk about that in a few weeks. Do you think there could actually be 2 different problems? My neck is really tight and like I said before I feel everything but my hand and arm tremors coming from my neck. I am really confused.",(neck pain OR cervicalgia) AND (tremor OR shaking) AND (laminectomy OR spinal surgery),,"It sounds like you're going through a very challenging and frustrating situation. Dealing with chronic pain, neurological symptoms, and conflicting medical opinions can be incredibly overwhelming, especially when it impacts your ability to work and your overall quality of life. It's completely understandable that you're feeling confused.

Let's break down the various aspects of your experience and explore some possibilities, keeping in mind that this is not a diagnosis and requires further investigation by qualified medical professionals.

**Regarding your neck pain, tightness, and related symptoms (lightheadedness, balance issues, back pain):**

*   **Possible Causes:** It's possible that your symptoms are related to post-laminectomy syndrome or continued issues stemming from your previous surgery. The original spinal stenosis may have contributed to changes in the spinal cord or nerve roots that persist even after the surgery. Muscle imbalances and postural changes after surgery can also lead to chronic neck pain and tightness. Given the timeframe since your surgery, scar tissue formation could also play a role.
*   **Evidence-Based Advice:**
    *   Continue with physical therapy, even if you haven't seen significant improvement yet. Different approaches or therapists might yield better results. Focus on exercises that strengthen your neck and back muscles, improve posture, and increase range of motion.
    *   Explore alternative pain management techniques, such as acupuncture, massage therapy, or mindfulness practices. These can sometimes offer relief when conventional treatments are less effective.
    *   Pay close attention to your posture throughout the day. Ensure your workstation is ergonomically sound, and avoid prolonged periods of looking down at screens or devices.

**Regarding the tremors:**

*   **Possible Causes:** While Parkinson's disease has been ruled out, tremors can have various causes. Essential tremor is a common neurological disorder that causes involuntary shaking. Other possibilities include medication side effects, metabolic disorders, or even stress and anxiety. The fact that the tremors are predominantly on one side (right) warrants further investigation.
*   **Evidence-Based Advice:**
    *   Keep a detailed log of your tremors, noting when they occur, what seems to trigger them, and how severe they are. This information can be very helpful for your healthcare provider.
    *   Consider lifestyle factors that might be contributing to the tremors. Are you consuming excessive caffeine or alcohol? Are you under a lot of stress? Making changes in these areas could potentially help.
    *   Discuss potential medication-related causes with your doctor.

**Could there be two separate problems?**

Yes, it's entirely possible, and the differing opinions from your healthcare providers seem to suggest this. The neck pain and associated symptoms could be related to post-surgical changes in your spine, while the tremors could be a separate neurological issue. The recent neurological tests (EEG, brain MRI, CT scan) being normal might indicate that the tremors are related to something not easily detectable with these tests.

**Regarding the proposed surgery:**

It's crucial to have a thorough understanding of the potential benefits and risks of any surgery. If the new neurosurgeon is stating that the surgery won't alleviate your pain or other symptoms, then proceeding with it requires careful consideration. You may want to ask for clarification on the goals of the surgery and whether it is primarily aimed at stabilizing your neck.

**Recommendations:**

1.  **Seek a second (or even third) opinion from neurologists and/or neurosurgeons *outside* of your current medical practice.** A fresh perspective is essential, especially given the conflicting opinions you've received. Look for specialists with experience in post-laminectomy syndrome and movement disorders.
2.  **Request a referral to a movement disorder specialist.** These neurologists have specialized expertise in diagnosing and treating tremors and other movement disorders.
3.  **Consider a comprehensive pain management program.** This type of program can offer a multidisciplinary approach to pain relief, including physical therapy, psychological support, and medication management.
4.  **Continue to advocate for yourself.** Don't be afraid to ask questions, express your concerns, and seek out the answers you need to make informed decisions about your care.

Remember, I am an AI and cannot provide medical diagnoses. Please schedule an in-person consultation with qualified healthcare providers to discuss your symptoms, medical history, and test results in detail. They can conduct a thorough examination, order additional tests if needed, and develop a personalized treatment plan that addresses your specific needs. I wish you the best in finding answers and relief.
",No valid docs,"{""rating"": 8, ""explanation"": ""Response A acknowledged the user's emotions, validated their concerns about conflicting medical opinions and job loss, and offered extensive support through potential causes, advice, and recommendations. The detailed breakdown showed a thorough understanding of the situation.""}","I'm so sorry to hear about your ongoing struggles and the distressing experiences you've had with multiple healthcare providers. It's completely understandable that you're feeling confused and frustrated.

As a doctor, my approach would be to carefully review all the information you've shared, considering both the physical and psychological aspects of your symptoms. I'd like to acknowledge that it's possible for there to be two or more underlying issues contributing to your overall presentation.

Let me summarize the key points:

1. You had cervical laminectomy surgery for spinal stenosis in 2010, which has led to ongoing neck tightness, pain, and other symptoms.
2. Your Neurologist attributes most of these issues to the neck tightness, while the Neuro Surgeon and Pain Management Specialist seem to agree with this assessment.
3. You've recently developed tremors in your right hand, arm, shoulder, neck, and head, which are daily and sometimes aggressive.
4. Despite extensive testing (MRI, EEG, Brain MRI, CT Scan), all results have been normal except for the CT Scan, which was conducted to assess healing after removing metal from your neck.

Given this information, I would suggest that it's possible for there to be two or more underlying issues contributing to your symptoms:

1. The ongoing neck tightness and related pain could be a primary issue, as suggested by your Neurologist.
2. The tremors in your right hand, arm, shoulder, neck, and head might be indicative of an additional neurological problem.

It's essential to continue seeking a second opinion from a different medical practice or specialist. I would recommend that you schedule appointments with both a neurosurgeon and a neurologist outside of your current healthcare network. This will allow for fresh perspectives and potential new insights into your situation.

In the meantime, here are some suggestions for symptom relief:

* Continue to follow up with your primary care physician or general practitioner to discuss any concerns you may have.
* Consider working with a physical therapist who has experience in treating patients with cervical spine issues. They can help you develop exercises and strategies to manage neck tightness and related pain.
* It might be helpful to keep a symptom journal or log to track when your tremors occur, as well as any potential triggers or patterns you notice.
* Consider consulting with a sleep specialist or a therapist to address any emotional or psychological stress you may be experiencing due to your ongoing struggles.

Remember that it's crucial to advocate for yourself and seek additional opinions to better understand the root causes of your symptoms. Don't hesitate to ask questions, clarify concerns, and explore all available options for achieving relief and improving your overall well-being.

Please let me know if there's anything specific you'd like me to address or if you have any further questions.",No valid docs,"{""rating"": 7, ""explanation"": ""Response B empathized with the user's struggles, validated the confusing medical opinions, and offered supportive suggestions. It acknowledged the physical and psychological aspects and provided a summary for clarity. However, Response A provided more detailed evidence based information.""}"
