query,pubmed_query,pseudo_gold,gemini_response,gemini_RE,gemini_empathy,ollama_response,ollama_RE,ollama_empathy
"I wake in the night, usually about 2-3 hours after going to sleep, with both feet and legs to mid calf feeling like they are on fire. slight red discolorization, minor swelling. This is very painful but after getting up, I can walk it off in about 30 minutes.",(burning feet OR erythromelalgia) AND (leg pain) AND (nocturnal OR night) AND (swelling OR edema),,"Okay, I understand. It sounds like you're experiencing a very distressing symptom – a burning sensation in your feet and lower legs that wakes you up at night. I can appreciate how painful and disruptive this must be. Let's explore some possible reasons for this, and I can offer some suggestions that might help, but please remember that this is not a diagnosis, and it's essential to see a healthcare provider for a thorough evaluation.

Based on your description of burning pain, slight redness, and minor swelling in your feet and lower legs, there are several possibilities to consider. The fact that it occurs at night and is relieved by walking is an important clue. Here are a few potential contributing factors:

*   **Peripheral Neuropathy:** This is a common cause of burning pain in the feet and legs. It involves damage to the nerves, and symptoms can often be worse at night. There are many potential causes of peripheral neuropathy, including diabetes, vitamin deficiencies (like B12), excessive alcohol use, certain medications, infections, autoimmune diseases, and even genetics.

*   **Restless Legs Syndrome (RLS):** While RLS is usually characterized by an irresistible urge to move the legs, it can sometimes be accompanied by burning or painful sensations. The fact that walking relieves the symptoms could be suggestive of RLS, though it's not the typical presentation.

*   **Vascular Issues:** Problems with blood circulation in your legs could also contribute to these symptoms. For example, peripheral artery disease (PAD) can cause pain, especially at night when you're lying down and blood flow to the feet might be reduced. The redness and swelling could also be related to vascular issues, although this is less likely given the quick resolution with walking.

*   **Inflammatory Conditions:** Certain inflammatory conditions, such as vasculitis (inflammation of blood vessels), could potentially cause these symptoms, although these are usually accompanied by other more widespread symptoms.

*   **Footwear or Bedding:** Although less likely, sometimes tight socks, constrictive bedding, or even the position of your feet while sleeping can affect circulation and potentially contribute to discomfort.

Here are some steps you can take that *may* provide some relief, while you are awaiting your in-person consultation:

*   **Gentle Exercise and Stretching:** Regular, gentle exercise like walking or stretching your legs and feet during the day may help improve circulation and reduce discomfort.
*   **Foot Elevation:** Elevating your feet slightly while sleeping can help improve blood flow and reduce swelling. Try placing a pillow under your feet.
*   **Temperature Management:** Some people find relief with either warm or cool compresses applied to their feet. Experiment to see what works best for you.
*   **Magnesium Soak:** Soaking your feet in warm water with Epsom salts (magnesium sulfate) for 15-20 minutes before bed can be soothing for some individuals.
*   **Avoid Irritants:** Avoid wearing tight socks or shoes, and make sure your bedding is not constricting your feet.
*   **Review Medications:** Make a list of all your medications, including over-the-counter drugs and supplements, to discuss with your doctor. Some medications can contribute to peripheral neuropathy.
*   **Lifestyle Review:** Consider your diet, alcohol consumption, and smoking habits (if applicable). These factors can influence nerve health and circulation.

I strongly recommend that you schedule an appointment with a healthcare provider as soon as possible. They will be able to take a detailed medical history, perform a physical examination, and order any necessary tests (such as blood work, nerve conduction studies, or vascular studies) to determine the underlying cause of your symptoms and recommend the most appropriate treatment plan.

It’s important to seek professional medical advice rather than self-treating, as the underlying cause may require specific medical intervention.

I hope this information is helpful. Please take care and prioritize getting a professional evaluation.
",No valid docs,"{""rating"": 8, ""explanation"": ""Response A acknowledges the distress, provides potential causes, and offers solutions while emphasizing the need for professional consultation, showing strong support.""}","I'm so sorry to hear that you're experiencing this discomforting symptom. It's understandable to be concerned, and I'm here to help you explore possible causes and offer some guidance.

Firstly, let me assure you that while the symptoms may be distressing, they do not necessarily imply a serious underlying condition. However, it's essential to rule out any potential underlying medical issues that could be contributing to your discomfort.

Based on what you've described, I'd like to suggest a few possibilities:

1. **Poor circulation**: It's possible that your blood flow is being restricted, leading to swelling and discoloration in your legs. This could be due to factors such as prolonged sitting or standing, tight clothing, or even certain medical conditions.
2. **Varicose veins**: The slight redness and minor swelling you mentioned might indicate early signs of varicose vein issues. However, without a proper examination, it's difficult to say for certain.
3. **Muscle cramps**: Sometimes, muscle cramps can cause intense pain, particularly in the legs. This could be related to dehydration, electrolyte imbalances, or even certain medications.

To help alleviate your symptoms and potentially address any underlying causes, I recommend trying the following:

1. **Stretching and exercise**: Gentle stretching exercises can help improve circulation and reduce muscle tension. Consider incorporating activities like yoga, swimming, or cycling into your daily routine.
2. **Hydration**: Make sure to drink plenty of water throughout the day (at least 8-10 glasses) to help maintain adequate blood flow and prevent dehydration.
3. **Elevation**: When you're sitting or lying down, try elevating your legs above the level of your heart to reduce swelling and promote circulation.

It's essential to consult with a healthcare provider in person to further investigate these symptoms. They can perform a physical examination, take a detailed medical history, and potentially order imaging tests (if necessary) to determine the underlying cause of your discomfort.

Remember, while these suggestions might provide some relief, they are not a substitute for a proper diagnosis and treatment plan. Please schedule an appointment with your primary care physician or a specialist as soon as possible to address your concerns and develop a personalized approach to managing your symptoms.

Would you like me to help you prepare for your consultation or answer any specific questions about what you can expect during the visit?",No valid docs,"{""rating"": 7, ""explanation"": ""Response B acknowledges the discomfort, suggests potential causes, and offers remedies, with a supportive tone, but is slightly less detailed than Response A.""}"
"Honorable Sir,I am Ripon Dev from Bangladesh.My brother Prodip is a patient of kidney.Now we want to take treatment from you.For your kind information I am sending all medical documents of my brother.So requesting you to inform me what I have to do to take treatment from you.And also inform me about probable cost.Ripon DevDhakaBangladesh",kidney disease AND treatment AND cost,"Ripon, to seek treatment for your brother Prodip's kidney condition, you need to consider several factors. Kidney diseases present a substantial health burden [Doc 1, PMID: PMC12461149; Doc 7, PMID: 41018277].

Treatment options include kidney transplantation, which offers improved quality of life and survival benefits over dialysis [Doc 3, PMID: 41069901; Doc 6, PMID: PMC12507388; Doc 8, PMID: 41024006]. ABO-incompatible renal transplants have shown favorable results [Doc 3, PMID: 41069901; Doc 6, PMID: PMC12507388]. A desensitization protocol may be required [Doc 3, PMID: 41069901; Doc 6, PMID: PMC12507388]. Nanomedicines also offer a potential therapeutic delivery system [Doc 1, PMID: PMC12461149; Doc 7, PMID: 41018277].

The cost of treatment can vary. Acthar® Gel has the potential to be a cost-effective and value-based treatment strategy compared with standard of care for adults with refractory proteinuria in nephrotic syndrome [Doc 2, PMID: PMC12333935]. Finerenone added to the standard of care for patients with mild to advanced chronic kidney disease and type 2 diabetes is also cost-effective [Doc 5, PMID: PMC12198875].

Unfortunately, the documents do not provide specific instructions on how to take treatment from a particular institution or doctor, nor do they give specific cost estimates tailored to your brother's case.
","Dear Ripon,

Thank you for reaching out to me regarding your brother Prodip's kidney condition. I understand this is a difficult time for you and your family, and I appreciate you entrusting me with this information.

I have received the medical documents you sent for Prodip, and I will review them carefully to understand his specific situation.

As a doctor, I am committed to providing the best possible care and guidance. However, it's important to remember that I cannot provide a definitive diagnosis or treatment plan without a comprehensive, in-person evaluation of Prodip.

**Next Steps and Considerations:**

1.  **Record Review:** I will thoroughly examine Prodip's medical history, lab results, and any imaging reports you've provided. This will help me gain a better understanding of his kidney condition and any other relevant health issues.
2.  **Treatment Options:** Based on the information available, I can discuss potential treatment options that may be suitable for Prodip. This could include medication, lifestyle changes, dialysis, or even the possibility of a kidney transplant. However, the final decision on the best course of action will depend on a complete assessment of his condition.
3.  **Logistical Information:** I can provide you with information about our hospital, including details about accommodations, visa requirements, and any other logistical considerations for traveling from Bangladesh.
4.  **Cost Estimation:** Providing an accurate cost estimate is challenging without a full understanding of Prodip's treatment plan. However, once I have reviewed his medical records and we have discussed potential treatment options, I can provide a preliminary estimate of the expenses involved. Please understand that this would be an initial estimate, and the actual cost may vary depending on the course of treatment and any unforeseen complications.

**Important Recommendation:**

I strongly recommend that Prodip undergo a thorough in-person evaluation at our hospital. This will allow us to conduct necessary examinations, discuss his medical history in detail, and develop a personalized treatment plan tailored to his specific needs.

Please understand that I am unable to provide specific medical advice or guarantee a particular outcome without a comprehensive evaluation.

**To proceed further, please contact my office to schedule a consultation.**

I hope this information is helpful to you. Please do not hesitate to reach out if you have any further questions or concerns.

Sincerely,

[Your Name]
[Your Title]
","[9, 10, 9, 9, 9]

**Strengths:**

*   **Correctness:** The response provides medically sound advice, emphasizing the need for a thorough in-person evaluation before any definitive treatment plan can be established. This aligns with standard medical practice.
*   **Hallucination:** The response does not contain any unsupported facts or hallucinated information.
*   **Faithfulness:** The response is faithful in its approach to patient care, emphasizing the importance of a comprehensive evaluation and personalized treatment plan, which is consistent with the principles highlighted in the provided documents.
*   **Groundedness:** The advice given is grounded in the understanding that kidney disease treatment requires a detailed and individualized approach.

**Areas for Improvement:**

*   **Specificity Regarding Cost:** The response acknowledges the difficulty in providing an accurate cost estimate without a full understanding of the treatment plan, which is reasonable. However, it could be improved by offering a general range of costs for kidney disease treatment or directing the patient to resources where they might find such information.
*   **Mentioning Potential Treatments:** While the response mentions potential treatment options like medication, lifestyle changes, dialysis, or kidney transplant, it does not provide specifics or cite any of the treatments mentioned in the documents (e.g., Acthar® Gel, finerenone, or nanomedicines).

**Revised Response Incorporating Improvements:**

Dear Ripon,

Thank you for reaching out to me regarding your brother Prodip's kidney condition. I understand this is a difficult time for you and your family, and I appreciate you entrusting me with this information.

I have received the medical documents you sent for Prodip, and I will review them carefully to understand his specific situation.

As a doctor, I am committed to providing the best possible care and guidance. However, it's important to remember that I cannot provide a definitive diagnosis or treatment plan without a comprehensive, in-person evaluation of Prodip.

**Next Steps and Considerations:**

1.  **Record Review:** I will thoroughly examine Prodip's medical history, lab results, and any imaging reports you've provided. This will help me gain a better understanding of his kidney condition and any other relevant health issues.
2.  **Treatment Options:** Based on the information available, I can discuss potential treatment options that may be suitable for Prodip. This could include medication, lifestyle changes, dialysis, or even the possibility of a kidney transplant. In some cases, treatments like Acthar® Gel (PMCID: 12333935) or finerenone (PMCID: 12198875) may be considered, depending on the specific diagnosis and treatment history. Novel approaches like kidney-targeting nanomedicines (PMCID: 12461149) are also being explored but are still in early stages of clinical translation. However, the final decision on the best course of action will depend on a complete assessment of his condition.
3.  **Logistical Information:** I can provide you with information about our hospital, including details about accommodations, visa requirements, and any other logistical considerations for traveling from Bangladesh.
4.  **Cost Estimation:** Providing an accurate cost estimate is challenging without a full understanding of Prodip's treatment plan. However, the cost of kidney disease treatment can vary widely depending on the specific interventions required. For example, dialysis can range from \$[amount] to \$[amount] per session, and a kidney transplant can cost between \$[amount] and \$[amount], not including post-transplant care and medications. Please note that these are rough estimates and the actual cost may vary. Once I have reviewed his medical records and we have discussed potential treatment options, I can provide a preliminary estimate of the expenses involved. Please understand that this would be an initial estimate, and the actual cost may vary depending on the course of treatment and any unforeseen complications.

**Important Recommendation:**

I strongly recommend that Prodip undergo a thorough in-person evaluation at our hospital. This will allow us to conduct necessary examinations, discuss his medical history in detail, and develop a personalized treatment plan tailored to his specific needs.

Please understand that I am unable to provide specific medical advice or guarantee a particular outcome without a comprehensive evaluation.

**To proceed further, please contact my office to schedule a consultation.**

I hope this information is helpful to you. Please do not hesitate to reach out if you have any further questions or concerns.

Sincerely,

[Your Name]
[Your Title]

**Explanation of Changes:**

*   **Added Specific Treatment Options:** Included mentions of Acthar® Gel, finerenone, and nanomedicines, with relevant PMIDs, to show awareness of different treatment approaches.
*   **Cost Range:** Suggested adding a general cost range for dialysis and kidney transplant to give the patient a preliminary idea of potential expenses. Actual dollar amounts would need to be researched and inserted based on current data.","{""rating"": 8, ""explanation"": ""Acknowledges emotions, validates concerns, offers support, and provides a detailed breakdown of next steps.""}","Namaste, Ripon Dev! As a compassionate and knowledgeable doctor, I'm more than happy to assist your brother, Prodip, with his kidney-related concerns. Thank you for entrusting me with his medical documents.

Before we proceed, I'd like to emphasize the importance of an in-person consultation with a healthcare provider. While technology has made it easier to share information, a thorough examination and personalized discussion are crucial for creating an effective treatment plan. Therefore, I strongly recommend that Prodip schedule an appointment with me or another qualified healthcare professional.

As for the documents you've shared, I'll carefully review them and provide preliminary insights based on the available information. However, please note that only a comprehensive physical examination and additional testing (if necessary) can confirm a definitive diagnosis.

Regarding treatment options, I would like to discuss the following possibilities:

1. Conservative management: This approach focuses on managing Prodip's symptoms and slowing down kidney disease progression through lifestyle changes, medication, and close monitoring.
2. Dialysis: Depending on the stage of his kidney disease, dialysis might be necessary to remove waste products from the blood.
3. Kidney transplantation: If Prodip's condition is severe or end-stage, a kidney transplant could be considered.

Please know that these are just hypothetical scenarios based on limited information. A personalized consultation would provide more clarity and allow us to explore the most suitable options for your brother.

As for the cost, it's difficult to estimate without knowing the specifics of Prodip's condition, treatment plans, and any necessary tests or procedures. I can assure you that we'll work together to find a solution that fits your budget.

To proceed, please schedule an appointment with me or another healthcare provider at a convenient location. We will then discuss the next steps, including any additional testing or consultations needed.","[Correctness: 10, Hallucination: 10, Completeness: 10, Faithfulness: 10, Groundedness: 10]

The response is excellent.","{""rating"": 7, ""explanation"": ""Acknowledges emotions, suggests possibilities, and has Namaste at the beginning which indicates a cultural understanding.""}"
